<?xml version="1.0" encoding="UTF-8"?>
<alumnos xmlns:xsi="http://www.w3.org/2001/XMLSchema-instance" xsi:noNamespaceSchemaLocation="ejercicio3.xsd">
  <alumno dni="1234567B">
    <nombre>Emiliano</nombre>
    <apellidos>Montesdeoca</apellidos>
    <nota>5.62</nota>
    <comentario>Hola</comentario>
  </alumno>
  <alumno dni="12345678X">
    <nombre>Yaco</nombre>
    <apellidos>Aymediacoan</apellidos>
    <edad>16</edad>
    <nota>9</nota>
    <direccion>
      <calle>Calle Fuente</calle>
      <numero>4.66</numero>
      <ciudad>Jabugo</ciudad>
      <codigopostal>38635</codigopostal>
    </direccion>
  </alumno>
  <alumno dni="1234567X">
    <nombre>Saulo</nombre>
    <apellidos>Saulini</apellidos>
    <edad>16</edad>
    <nota>No presentado</nota>
    <comentario>Hola</comentario>
    <direccion>
      <calle>Calle Fuente</calle>
      <numero>4</numero>
      <ciudad>Jabugo</ciudad>
      <codigopostal>38111</codigopostal>
    </direccion>
  </alumno>
</alumnos>
